
<!ELEMENT lista (item+, total, cantidad_total)>
<!ELEMENT item (titulo, categoria, producto, descripcion, unidades, precio, marca, costo)>
<!ATTLIST item
          categoria CDATA #REQUIRED
          id CDATA #REQUIRED
          precio CDATA #REQUIRED
          titulo CDATA #REQUIRED>
<!ELEMENT titulo (#PCDATA)>
<!ELEMENT categoria (#PCDATA)>
<!ATTLIST categoria
          id CDATA #REQUIRED
          nombre CDATA #REQUIRED
          recurso CDATA #REQUIRED>
<!ELEMENT producto (#PCDATA)>
<!ATTLIST producto
          recurso CDATA #REQUIRED>
<!ELEMENT descripcion (#PCDATA)>
<!ELEMENT unidades (#PCDATA)>
<!ELEMENT precio (#PCDATA)>
<!ELEMENT marca (#PCDATA)>
<!ELEMENT costo (#PCDATA)>
<!ELEMENT total (#PCDATA)>
<!ELEMENT cantidad_total (#PCDATA)>